,Name,Company,City,Location,Url,JOB_INFO
8,Data Analyst, Hike,New Delhi,New Delhi,https://www.glassdoor.com/partner/jobListing.htm?pos=109&ao=14295&s=58&guid=00000170cffbaafba9853bb1bf47e631&src=GD_JOB_AD&t=SR&extid=1&exst=OL&ist=&ast=OL&vt=w&slr=true&ea=1&cs=1_3a16fa0d&cb=1584037342163&jobListingId=3501337994,"A New Social Future .How is it that in a world that's evolving so quickly that social products still feel the same? Strangely enough, we're still using products that were invented in the 2G era. There seems to be an emptiness with the current experience and today's products are built to force humanity to be superficial. .We'd like to change that. .With the advancements in technology, so much more is possible today that wasn't even possible, just a few years ago. We believe the timing couldn't be better. .6 Principles .We’re thoughtful about why we do things and here are 6 principles guiding our thinking: .Advancements in Tech & AI .: Allowing more bits to be pushed to users in real-time and thus allowing far richer, more personalised experiences. .Bits Cheaper than Atoms .: Today, bringing rich, luxurious experiences to the masses is faster, more efficient and cheaper online than it is offline. .Self Worth Moving Online .: 40% of people's waking life is now spent on their smartphones. The next generation is far more comfortable online than offline. .Vertical Communities .: We don't live our lives in one massive community. We're specific in the activities we engage in (art, gaming, fitness etc). .New Business Models .: Putting customer at the centre. These won't be ad-driven in the traditional sense. Think micro-transactions, subscriptions and more. .Consumers as Owners .: It's a bit strange that consumers aren't part of the value chain. Turning customers into owners is a fascinating thought. .Build Magical Things .It’s so clear to us that technology evolves but people stay the same. We’re solving for a core human need - social connection and with all the evolution in technology, today we can solve for that in brand new ways. .At our core, we’re a creative company. Ideas and pixels is where we live and we love building magical products that make our users feel ‘wow’ inside. It’s not just about features, it’s also about how they make people feel. We build at the intersection of the scientific and the romantic. .And it all starts with people, the right team that cares deeply about our mission, values and our users. At hike, you'll have the chance to do the best work of your life. .Come join us and shape the future of social. .The Hike Code .We’re on a journey to build something new, something different and making anything innovative & new requires the ability to surrender to the unknown. The Hike Code is our value system. It is our guide to navigate through the unknown to build incredible products. Here they are: .Top Talent in Every Role .: We look for people with an incredible intellect. Both skills and values are important to us. .Pro-Sports Team .: Strengths based, results driven with a ""team-first"" attitude .Customer at the Centre .: Everything we do is inspired by how can we better solve for our customer. .Constant Innovation .: It's our DNA to walk into the unknown in search of having meaningful impact. .Act Like Owners .: We own the output of what we do, even if it's explicitly not our job. .Thoughtful Decision Making .: Clear Mind + Obsession to Simplify + Data Driven. We strive to be thoughtful. .Always be Hustling .: We understand that success is not one big leap but tiny gains compounding over time #ABH. .Be Open Minded & Coachable .: We have a quest to continuously #RiseUp to be the best version of ourselves. .Role .If you've made it till here, you're probably still interested in the role :) .As a Data Analyst, you will: .Perform quantitative analyses that translate data into actionable insights and provide analytical, data-driven decision-making support for key projects. .Provide reporting and performance monitoring to product teams using data drawn from diverse sources. .Own and evangelize data-driven experimentation in the team to improve the product offerings, and document it. .Enable product reviews, deep dives and analyses through the effective use of data and communicate and report insights and recommendations to shape product strategy. .Ensure that any data required for carrying out the other responsibilities for the product/features you’re working on is properly instrumented and logged. .Requirements .Sounds Like You? .You have a Bachelor’s degree in Math, Statistics, Comp Science, Engineering, or other technical field required; advanced degrees strongly preferred. .You are hands on with Python/ Java Programming language. .You have a very good understanding of mobile and Internet products, growth strategies and business dynamics. .You are comfortable manipulating, transforming, and analysing complex, high-volume, high-dimensionality data from varying sources. .You have 3+ years experience performing quantitative analysis, preferably for an Internet or technology company. .You have hands-on working experience on SQL queries. .You have experience in reporting and dashboards involving very large datasets and multiple data sources, with the ability to interpret data and produce meaningful insights. .You have good understanding of statistical analysis, data warehousing, data modelling. .You have experience with statistical packages such as SPSS, SAS etc. and BI/visualisation tools such as Tableau, Google Analytics etc. .You have ability to execute research projects and craft actionable recommendations. .You have proven ability to work in a fast-paced environment, meet changing deadlines and priorities on multiple simultaneous projects. .You have excellent organisational, communication, presentation and interpersonal skills. .You enjoy working in both individual and team settings. .Benefits .A flat and transparent culture .Flexible working hours - No fixed Checkin/Checkout .Unlimited Snacks, food, and drinks on the house .Tools of the trade - MacBook, Latest Softwares .Monthly Communication Reimbursement .Best learning and development opportunities .A chance to have a big impact early in your career .At Hike, we value diversity. We are an equal opportunity employer: we do not discriminate on the basis of race, color, religion, gender, ethnicity or disability status."
9,Data Analyst, Midland Credit Management,Gurgaon,Gurgaon,https://www.glassdoor.com/partner/jobListing.htm?pos=110&ao=799102&s=58&guid=00000170cffbaafba9853bb1bf47e631&src=GD_JOB_AD&t=SR&extid=1&exst=OL&ist=&ast=OL&vt=w&slr=true&cs=1_f54d4cee&cb=1584037342164&jobListingId=3525633869,"Here at MCM, we recognize and value success: for our consumers, for our communities, for you as an individual, and for us as a team. We support your career aspirations and provide the benefits you need to live the fulfilling life you want. You make a difference for us through your attitude and achievements and we will always strive to make a difference for you. Be part of MCMs amazing journey, where your success is valued! .The Sr analyst will be primarily responsible for working closely with business users and Analytics team members to understand requirements and develop high quality actionable data-driven solutions. He/She will be the First point of contact for reporting/data management needs and will be responsible to drive complex data analysis and propose improvement opportunities in existing tools and reports. The Data analyst / Sr Data Analyst will be responsible to establish best practices in data management, data visualization and report distribution. .PRINCIPAL RESPONSIBILITIES .Design, Development and enhancement of complex business reports independently with high degree of accuracy and timeliness.Leverage different tools and technologies like SAS, SQL, Advanced Excel and BI reporting tools to develop reports for automation and distribution of reports.Migration of reports as the company adopts new technologies like Power BI, SSRS and SSAS - 40% .Develop SAS programs to load raw data from different databases, apply complex business logic and generate curated data-sets to be used by business users for reporting and decision-making. Develop tools or interactive applications using VBA and advanced Excel to automate manual processes- 30% .Supporting complex business data analysis needs by understanding requirements and converting into technical deliverables. Leverage data warehouse and other data sources to answer business queries.- 20% .Develop and maintain documentation for all processes including SOPs, Code inventory etc.- 10% .REQUIRED SKILLSET .Education .Degree :Bachelor .Field of Study :Engineering,Computer Science .Experience :2-4 years in IT / ITES .Technical Skills: SAS / SQL / VBA / Excel .Other Skills :Good communication (Written and Verbal) ,Ability to quickly grasp new technologies,Logical Thinking,Analytical ability .Languages: English .PREFERRED SKILLSET .Degree: Master or Advanced .Field of Study :Engineering, Computer Science .Experience:Incl. experience on Financial services / Call Center domains .Technical Skills :Familiarity with DW concepts and BI environment,Knowledge of MS BI reporting stack - Power BI, SSRS, SSAS .Position Status .Full time .Established in 1953, Midland Credit Management, Inc. (MCM), a wholly-owned subsidiary of Encore Capital Group, Inc., is a specialty finance company providing debt recovery solutions for consumers across a broad range of assets. We are the market leader in portfolio purchasing and recovery in the United States, and we lead the industry with consumer-centric practices that drive results. We have operations in India, Costa Rica, and 35 US Sites."
10,Data Analyst, Paytm,Noida,Noida,https://www.glassdoor.com/partner/jobListing.htm?pos=111&ao=437149&s=58&guid=00000170cffbaafba9853bb1bf47e631&src=GD_JOB_AD&t=SR&extid=1&exst=OL&ist=&ast=OL&vt=w&slr=true&cs=1_766693f3&cb=1584037342166&jobListingId=3200347244,"Part of Paytm wallet web/app/customer analytics team .Responsible to Analyze raw data, Manipulate, Cleanse and Process data using Hive/Sql/R/Python and throw insights on effectiveness of campaigns running on Paytm marketplace. .Responsible for performing data driven growth analytics for building topline and optimizing marketing spends .Key technical skills (not all are mandatory) .Expertise in Excel, SQL, R/Python .Experience with Big Data technologies preferably Hive, Spark .Familiarity with visualization tools like Tableau, Grafana .Familiarity with basic statistical techniques for prediction and optimization .Desired experience: .1-3 years in analytics firm or analytics divisions of e-commerce firms .Ability to work under high pressure .Structured problem solving"
11,Senior Data Analyst - Ad Tech, Saavn,Gurgaon,Gurgaon,https://www.glassdoor.com/partner/jobListing.htm?pos=112&ao=577699&s=58&guid=00000170cffbaafba9853bb1bf47e631&src=GD_JOB_AD&t=SR&extid=1&exst=OL&ist=&ast=OL&vt=w&slr=true&ea=1&cs=1_3fccb5c1&cb=1584037342167&jobListingId=2922780149,"JOB TITLE: SENIOR DATA ANALYST - AD TECH .LOCATION: GURGAON, INDIA .OUR STORY: .JioSaavn is South Asia's leading music streaming service. We are over 200 entrepreneurs, across New York, California, Mumbai, Gurgaon, and Bangalore, who help music lovers access, discover, and listen to their favorite songs across languages and genres. In early 2018, a merger between JioMusic and Saavn was announced; creating a combined entity valued at over $1 billion. .We blend digital technology, data analysis (which we have affectionately coined Music Science), and a strong, fearless business acumen to reach all corners of the globe. Through partnerships with Apple, Google, Amazon, Facebook, Twitter and Shazam - to name a few - JioSaavn reaches more music fans across the world. Our award-winning mobile products, partnerships, innovations and thought leadership have been featured in some of the world's leading publications, from The New York Times, to The Wall Street Journal, The Economic Times to Forbes, and many more. We are well-funded by some of the world's most successful institutional investors and global media companies as well as a number of strategic individuals. Beyond investing, they are advisors and supporters of our vision, our passion, and our collective ability to deliver a revolutionary music experience as the leader in India. .OUR CULTURE: .At JioSaavn, we ignite passion and performance to work towards a collective goal: creating the perfect mobile entertainment ecosystem that delivers the best possible music experience to millions of listeners around the world. Our default mode is that of perpetual innovation. Together, we form a concerted rhythm that goes beyond borders. We don't just go with the flow, we create it. .JioSaavn offers a dynamic and unconventional work environment, full of fun wholesome experiences from in-office performances by some of the world's most beloved musicians to opportunities for international travel. We believe creativity and technology blend together like sweet melodies. When you choose JioSaavn, you join a diverse world of high-calibre techies, artists, and inventors hailing from companies like Yahoo!, Twitter, LinkedIn, Google, Qualcomm, HBO, Microsoft, Flipkart, Amazon, Paytm, Quikr, MSN, and NDTV. We are one of the few digital companies to provide employment opportunities that meet the Silicon Valley benchmark right here in Mumbai! Figures, since we've got Silicon Valley covered, too. .Our value-based, people-first work culture is about empowering every individual in our global team to be catalysts for change in this dynamic digital world. Every day is an opportunity to bring your vision to life, and to expand, learn and grow. No idea is left unconsidered. No voice is left unheard. .With listeners speaking multiple languages in almost every country in the world, we like to think we have the most diverse user base on the planet. This has only been made possible because of the value we place on radical inclusivity in our offices across the globe. We believe different is wonderful, and what sets us apart is also what brings us closer. JioSaavn prides itself on being an equal opportunity employer. We have committed ourselves to creating a safe environment with fair and equal access and opportunities, sans discrimination. We encourage everyone to be open to experiences and perspectives beyond their normal; divergent thinkers create differentiated products, and even better music. .If our vibe matches with yours, we'd love to hear from you. .ROLE: .JioSaavn is seeking a Senior Data Analyst who will use their expertise in data-mining, quantitative analysis & data visualization to tell the story behind numbers and derive actionable insights for JioSaavn advertisers and help in achieving business goals. .RESPONSIBILITIES: .Provide relevant data to the Sales team to help them in their conversation with the clients .Conceptualize and build dashboards that are simple, visually appealing, yet showcase a powerful story .Solve ambiguous problems using data and providing practical business insights .Provide actionable insights to multiple stakeholders in the organization .Improve understanding of user engagement; setting KPIs, monitoring key trends and partnering with product and strategy teams to optimize customer experience based on insights delivered .Perform hands-on analysis of large volumes of data and across multiple datasets primarily using SQL and Python/R. .Design models to solve business problems and, where appropriate, manage integration of the insights into regular reporting .Understand business challenges and transform them into advanced analytics / machine learning / data mining problems; use your analytics toolbox to effectively solve them .Consult/support ad-hoc requests for data and analysis .REQUIREMENTS: .Bachelors in quantitative field such as Engineering/Mathematics/Statistics/Physics/Economics .2+ years of experience in advanced statistical analysis and modelling .Efficient programmer in Python/R .Experience in manipulating large data sets from multiple sources (SQL, S3) .Passionate about solving real world problems using machine learning .High level of intellectual curiosity and willingness to take action by generating business insights .Expertise in visualizing complex data using Tableau/R/Python .Strong written and oral communication skills .BENEFITS AND PERKS: .At JioSaavn, we blur work and play, and you get all the perks of a global company. You will get to work with a dynamic group of entrepreneurs, who are delivering results and working zealously across time zones to make a difference in the way the world experiences music. We love what we do, and we think you will too. .Group Mediclaim .Fun Fridays .Flexible vacation policies .Free healthy (and unhealthy) lunches & snacks .JioSaavn-sponsored team outings"
12,Data Analyst, Encore Capital Group,Gurgaon,Gurgaon,https://www.glassdoor.com/partner/jobListing.htm?pos=113&ao=4120&s=58&guid=00000170cffbaafba9853bb1bf47e631&src=GD_JOB_AD&t=SR&extid=1&exst=OL&ist=&ast=OL&vt=w&slr=true&cs=1_185a999d&cb=1584037342169&jobListingId=3525515419,"Here at MCM, we recognize and value success: for our consumers, for our communities, for you as an individual, and for us as a team. We support your career aspirations and provide the benefits you need to live the fulfilling life you want. You make a difference for us through your attitude and achievements and we will always strive to make a difference for you. Be part of MCM’s amazing journey, where your success is valued! .The Sr analyst will be primarily responsible for working closely with business users and Analytics team members to understand requirements and develop high quality actionable data-driven solutions. He/She will be the First point of contact for reporting/data management needs and will be responsible to drive complex data analysis and propose improvement opportunities in existing tools and reports. The Data analyst / Sr Data Analyst will be responsible to establish best practices in data management, data visualization and report distribution. .PRINCIPAL RESPONSIBILITIES .Design, Development and enhancement of complex business reports independently with high degree of accuracy and timeliness.Leverage different tools and technologies like SAS, SQL, Advanced Excel and BI reporting tools to develop reports for automation and distribution of reports.Migration of reports as the company adopts new technologies like Power BI, SSRS and SSAS - 40% .Develop SAS programs to load raw data from different databases, apply complex business logic and generate curated data-sets to be used by business users for reporting and decision-making. Develop tools or interactive applications using VBA and advanced Excel to automate manual processes- 30% .Supporting complex business data analysis needs by understanding requirements and converting into technical deliverables. Leverage data warehouse and other data sources to answer business queries.- 20% .Develop and maintain documentation for all processes including SOPs, Code inventory etc.- 10% .REQUIRED SKILLSET .Education .Degree :Bachelor .Field of Study :Engineering,Computer Science .Experience :2-4 years in IT / ITES .Technical Skills: SAS / SQL / VBA / Excel .Other Skills :Good communication (Written and Verbal) ,Ability to quickly grasp new technologies,Logical Thinking,Analytical ability .Languages: English .PREFERRED SKILLSET .Degree: Master or Advanced .Field of Study :Engineering, Computer Science .Experience:Incl. experience on Financial services / Call Center domains .Technical Skills :Familiarity with DW concepts and BI environment,Knowledge of MS BI reporting stack - Power BI, SSRS, SSAS .Position Status .Full time .Established in 1953, Midland Credit Management, Inc. (MCM), a wholly-owned subsidiary of Encore Capital Group, Inc., is a specialty finance company providing debt recovery solutions for consumers across a broad range of assets. We are the market leader in portfolio purchasing and recovery in the United States, and we lead the industry with consumer-centric practices that drive results. We have operations in India, Costa Rica, and 35 US Sites."
13,Data Analyst, Mindteck,Gurgaon,Gurgaon,https://www.glassdoor.com/partner/jobListing.htm?pos=114&ao=4120&s=58&guid=00000170cffbaafba9853bb1bf47e631&src=GD_JOB_AD&t=SR&extid=1&exst=OL&ist=&ast=OL&vt=w&slr=true&cs=1_29f689b5&cb=1584037342170&jobListingId=3353512243,Location: .Gurgaon .Qualification: .Any Graduate .Experience: .2-4 years .Job Description: .Should have worked as a Data Analyst .Strong in Excel and Macros etc .APPLY NOW
14,Financial Data Analyst - India, Clearwater Analytics,Noida,Noida,https://www.glassdoor.com/partner/jobListing.htm?pos=115&ao=600635&s=58&guid=00000170cffbaafba9853bb1bf47e631&src=GD_JOB_AD&t=SR&extid=1&exst=OL&ist=&ast=OL&vt=w&slr=true&cs=1_3a3baab6&cb=1584037342171&jobListingId=3307075305,"About Clearwater Analytics® .Clearwater Analytics® is a global SaaS solution for automated investment data aggregation, reconciliation, accounting, and reporting. Clearwater helps thousands of organizations make the most of investment portfolio data with cloud-native software and client-centric servicing. Every day, investment professionals worldwide trust Clearwater to deliver timely, validated investment data and in-depth reporting. .Clearwater aggregates, reconciles, and reports on more than $3 trillion in assets across many Fortune 500 clients. .Position Details .As a member of Clearwater's Data Team, you will be responsible for maintaining the integrity of Clearwater's security master which includes 345,000 active and over 1.9 million total securities spanning a wide variety of asset classes. You will collaborate with a global team across various functional roles to ensure our data offering and asset modeling is truly world class. When deficiencies are identified, you will be tasked with finding and implementing solutions with an unwavering commitment to client success. In addition to your focus and attention to identifying and correcting individual data points, you may also be asked to analyze Clearwater's data set from a more holistic perspective to identify opportunities and strategies to improve quality controls. .Responsibilities .Identify and analyze potential data sources which will improve the consistency, timeliness and/or completeness of our data sets .Leverage SQL and internal tools to update and maintain security master integrity .Effectively distill complex subjects to clear, concise communication .Utilize programming and internal tools to re-engineer inefficient processes with the goal of improving system automation, speed, accuracy, and operational workflow .Work on a dynamic and fast paced team, applying your analytical and problem-solving skills for maximum impact across the organization and industry .Strategize with cross-functional teams to improve our client experience, operational efficiency, and prospective opportunities .Identify patterns and trends in order to research and resolve problems/inconsistencies in our data set .Requirements .Strong problem solving, math, and communication skills .Passion, Perseverance, and Accountability with an innate desire to drive client success .Bachelor's degree in Accounting, Finance, Data Science, Math or related area of study .Ability to read and understand at least one programming language (i.e. Python, Java, VBA, etc.) .Experience with SQL or other relational databases .5+ years of professional work experience .3+ years experience working with security reference data .Proficiency working with Microsoft Office, including Excel .Work with minimal direction and ability to coordinate complex activities in an evolving environment .Desired Experience and Skills .Experience with business intelligence solutions .Experience in investment management front office or operations or within an international data provider .What we offer: .Business casual atmosphere in a flexible working environment .Team focused culture that promotes innovation and ownership .Access to cutting edge investment reporting technology and expertise .Continual learning, professional development and growth opportunities .Competitive salary and benefits package; including health, vision and dental"
