,Name,Company,City,Location,Url,JOB_INFO
25,Data Analyst, SSPL,New Delhi,New Delhi,https://www.glassdoor.com/partner/jobListing.htm?pos=126&ao=437149&s=58&guid=00000170cffbaafba9853bb1bf47e631&src=GD_JOB_AD&t=SR&extid=1&exst=OL&ist=&ast=OL&vt=w&slr=true&cs=1_c28ac517&cb=1584037342182&jobListingId=3201408372,"Required Skills & Experience .We are looking for a Data Analyst Executive .Eligible Qualifications : .B. Tech, BCA, M.Tech, MCA .Experience : .3-5 years, fresher’s can also be considered .Location of Job : .Gurgaon/Connaught Place, New Delhi .Technicals Skills .Following technical skills are pre-requisite: .Well versed with Software development methodologies, such as SDLC (Software Development Life Cycle), DDLC (Document Development Life Cycle). .Database schema design and implementation .Should have worked in either of technologies Sql Query/ Tableau/ Excel (Macros)/ Access (Query) writing for data analytics. .For planning and coordinating activities, organizations remain in invariant communication with one another and the data transfer has to be performed efficiently and smoothly as possible. .He/ She should manage the execution of the technologies, help the businesses in utilizing the systems, and should be well versed with the basics of computer systems such as Networking, Installation of necessary software and hardware. .Ability to determine the interrelationships between solutions and requirements. .Ability to think analytically and should be a problem solver and logic building should be very strong. .Good interpersonal skills to form effective working relationships with people at all levels. .Excellent communication and presentation skills and strong written & oral English skills."
26,Associate / Analyst - Data Engineer : Mumbai /, BlackRock,Gurgaon,Gurgaon,https://www.glassdoor.com/partner/jobListing.htm?pos=127&ao=566077&s=58&guid=00000170cffbaafba9853bb1bf47e631&src=GD_JOB_AD&t=SR&extid=1&exst=OL&ist=&ast=OL&vt=w&slr=true&cs=1_b2e58563&cb=1584037342184&jobListingId=3522347660,"Description .About this role .FMG is a diverse and global team with a keen interest and expertise in all things related to technology and financial analytics. The group is responsible for the research and development of quantitative financial models and tools across many different areas - single-security pricing, prepayment models, risk, return attribution, optimization and portfolio construction, scenario analysis and simulations, etc. - and covering all asset classes. The group is also responsible for the technology platform that delivers those models to our internal partners and external clients, and their integration with Aladdin. FMG conducts leading research on the areas above, delivering state-of-the-art models. FMG publishes applied scientific research frequently, and our members present regularly at leading industry conferences. FMG engages constantly with the sales team in client visits and meetings. .Job Purpose/ Background .FMG is looking for self-starter date engineer to contribute on the research data platform. The data platform is compelling analytics offering, supported by high quality historical data. This encompasses both individual security as well as index constituent levels and portfolio context. This historical data includes indicative information, prices, analytics, exposures, index-related and other fields. This data is fully quality-controlled and can be integrated with client custom data. This data set will be utilized by working with modelers for research and by clients for analytics. To design, implement and maintain this platform we would primarily need Scala and distributed computing knowledge using Hadoop and Spark along with knowledge for data curation and analytical jobs. Experience with DevOps will be handy as we move to cloud. .Key Role Responsibilities .Specifically, we expect the role to involve the following core responsibilities and would expect a successful candidate to be able to demonstrate the following (not in order of priority) .Design, maintenance and ownership of a Data Infrastructure .Working with the subject matter experts and modelers to understand the business and their requirements. Help determine the optimal data set and structure to deliver on those user requirements .Understanding the data and setup and monitor the QC/ Surveillance .Implementation of and maintenance of a standard data / technology deployment workflow to ensure that all deliverables/enhancements are delivered in a disciplined and robust manner .Experience .Experience on Scala .Knowledge of ETL, data curation and analytical jobs using distributed computing framework with Spark and Hadoop .Knowledge and Experience of working with large enterprise wide databases .Experience with big data technologies such as Hadoop, Pig, Cassandra, Spark .Aptitude for design and building tools for data due diligence and data extraction pipeline .Java /Python knowledge is a plus .DevOps experience is a plus .Qualifications .B.E. / B. Tech. / Masters in Computer Science or related field .2-8 years of programming experience and 2-5 years of relevant experience .About BlackRock .BlackRock's purpose is to help more and more people experience financial well-being. As a fiduciary to investors and a leading provider of financial technology, our clients turn to us for the solutions they need when planning for their most important goals. As of December 31, 2019, the firm managed approximately $7.43 trillion in assets on behalf of investors worldwide. .For additional information on BlackRock, please visit www.blackrock.com/corporate | Twitter: @blackrock | .Blog: www.blackrockblog.com | LinkedIn: www.linkedin.com/company/blackrock .BlackRock is proud to be an Equal Opportunity and Affirmative Action Employer. We evaluate qualified applicants without regard to race, color, national origin, religion, sex, sexual orientation, gender identity, disability, protected veteran status, and other statuses protected by law. .BlackRock will consider for employment qualified applicants with arrest or conviction records in a manner consistent with the requirements of the law, including any applicable fair chance law."
27,Manager (Data Analyst), OYO,Gurgaon,Gurgaon,https://www.glassdoor.com/partner/jobListing.htm?pos=128&ao=769440&s=58&guid=00000170cffbaafba9853bb1bf47e631&src=GD_JOB_AD&t=SR&extid=1&exst=OL&ist=&ast=OL&vt=w&slr=true&ea=1&cs=1_2cd7ed1f&cb=1584037342185&jobListingId=3402050751,"Manager (Data Analyst) .Location-Gurgaon .Oyo Rooms, also known as Oyo Homes & Hotels, is an Indian hotel chain. It is the world's third-largest, one of China's top two and the fastest growing hospitality chain of leased and franchised hotels, homes & living spaces. Founded in 2013 by Ritesh Agarwal, OYO initially consisted mainly of budget hotels. Over a span of 6 years, the startup expanded globally with thousands of hotels, vacation homes and millions of rooms across hundreds of cities in India, Malaysia, UAE, Nepal, China, UK, Philippines, Japan, Saudi Arabia, Sri Lanka, Indonesia, Vietnam, United States and more. The company's investors include SoftBank Group, Greenoaks Capital, Sequoia India, Lightspeed India, Hero Enterprise, Airbnb and China Lodging Group. .ROLES & RESPONSIBILITIES .Make OYO a data driven organization by creating platforms to better access, interpret and use data in driving day-to-day decisions and business functioning .Provide analysis support on project, new initiatives and strategic decisions. Collaborate with business, product and technology teams to implement projects .Develop processes for effective data analysis and reporting .Generate insights for other business and product teams by providing them understandable and actionable reports from data .Hire and manage team of data analysts .BASIC QUALIFICATIONS .6+ years of professional experience in analytics field .Degree in engineering, statistics, mathematics, computer science or other quantitative areas .Should have excellent written and verbal communication skills .Should have deep knowledge of SQL to extract and transform data into meaningful analyses and reports .Should have extensive experience in data visualization using tools like Tableau/Qliksense/PowerBI/Superset/Metabase .Should have knowledge of Python/R programming language .GOOD TO HAVE .Should be able to prioritize in fast-moving complex environment and produce solutions despite complex requirements .Understanding of big data technology like, Hive, presto etc."
28,Data Analyst, BHP,New Delhi,New Delhi,https://www.glassdoor.com/partner/jobListing.htm?pos=129&ao=4120&s=58&guid=00000170cffbaafba9853bb1bf47e631&src=GD_JOB_AD&t=SR&extid=1&exst=OL&ist=&ast=OL&vt=w&slr=true&cs=1_09c3ca2c&cb=1584037342186&jobListingId=3523244788,"Data Analyst .You already applied for this job. .Region .Asia Pacific .Location .India - New Delhi .Work type .Full Time .Job category .Marketing .Date published .27 February 2020 .Date closing .15 March 2020 .at 00:00 GMT .About BHP .At BHP we support our people to grow, learn, develop their skills and reach their potential. With a global portfolio of operations, we offer a diverse and inclusive environment with extraordinary career opportunities. Our strategy is to focus on creating a safe work environment where our employees feel strongly connected to our values and objectives, and where the capability of our people is key to our success. Come and be a part of this success. .About the role .The Market Analysis & Economics (MAE) team is BHP’s in-house research and analysis unit. We help to influence and shape value creating decisions through rigorous, independent and innovative research, analysis and forecasting of macroeconomic and commodity market developments. .Purpose: .We are looking to hire a Data Analyst to join our team. You will be responsible for managing our master data set, developing reports, and troubleshooting data issues. To do well in this role you need a very fine eye for detail, experience as a data analyst, and deep understanding of the popular data analysis tools and databases. .Core Accountabilities .Demonstrates and instils an overriding commitment to health, safety, environmental responsibility and sustainable development. .Demonstrates commitments to the BHP Charter and Code of Business Conduct. .Manages MAE data, including collection, creation, updates, and deletion. .Manages users and user roles. .Processes confidential data and information according to guidelines .Helps to develop reports and analysis. .Manages and designs the reporting environment, including data sources and security .Supports initiatives for data integrity and normalisation. .Generates reports from single or multiple systems. .Troubleshoots the reporting database environment and reports. .Trains end users on new reports and dashboards. .Provides technical expertise on data storage structures, data mining, and data cleansing. .Assists the Vice President Market Analysis and Economics with projects as required. .Assists the leadership of the Indian Office with projects as required. .About You .Ideally you will have: .A Bachelor’s degree from an accredited university or college in a quantitative discipline. .Work experience as a data analyst or in related field. .Experience in methodologies and processes for managing large scale databases. .The ability to work with global set of stakeholders. .Experience with Spotfire and Eviews preferred. .High-level written, visual and verbal communication skills. .Attention to detail is critical. .Supporting a diverse workforce .At BHP, we recognise that we are strengthened by diversity. We are committed to providing a work environment in which everyone is included, treated fairly and with respect. We are an Equal Opportunity employer and we encourage applications from women and Indigenous people. We know there are many aspects of our employees’ lives that are important, and work is only one of these, so we offer benefits to enable your work to fit with your life. These benefits include flexible working options, a generous paid parental leave policy, other extended leave entitlements and parent rooms."
29,MI Data Management Analyst, American Express Global Business Travel,Gurgaon,Gurgaon,https://www.glassdoor.com/partner/jobListing.htm?pos=130&ao=804560&s=58&guid=00000170cffbaafba9853bb1bf47e631&src=GD_JOB_AD&t=SR&extid=1&exst=OL&ist=&ast=OL&vt=w&slr=true&cs=1_793bbbb8&cb=1584037342187&jobListingId=3435877383,"Job Responsibility: .With each inbound extract check/identify/report for compatible formats, missing data, anomalies, file type, date formats, number formats, invalid air, car, hotel codes, date range, duplication, no data procedures. .Manage RSCC & HMM tasks or any process related tasks that .Co-ordinate with global operations teams/depts./offices to ensure data accuracy .Maintain high level of quality and compliance scores .Identify and drive operational efficiencies .Work in tandem with the team to ensure that the SLA’s are met on a consistent basis .Effectively work and communicate with all departments and heads within GBT (all its affiliates) & Vendor Partners to fulfill business requirements in a prompt and efficient manner. .Is team player. .Share new insights and developments with team members. .Commitment to team goals and deadlines. .Work with peers to develop better procedures, solve problems and investigate issues. .Loading files and managing rules / tables in CAP, Balancing and reconciliations of MI data for clients. Run reports, correct file errors, normalize data. .CAP Updates & Maintenance activities .Level 2 case support for post travel data issues .Data loading, normalizing and managing data flows through processes into CAP .Consolidations of various competitor data for customers single point of reporting for all travel transactions .Collaborate with all data sources to compile data flow and integrate into a single set of client data, establish reporting fields and format .Requirement: .3+ years of experience in client facing analytics and\\or MI product support .Strong quantitative, analytical, problem solving & reconciliation skills .Good knowledge of SQL\\MS Access is required .Advance knowledge of MS Excel is preferable .Excellent communication and presentation skills, both verbal and written .Strong ability to manage and accommodate demanding situations simultaneously .Strong organizational and time management skills .Ability to handle confidential information .Detail oriented with excellent follow up .Knowledge of Travel Data\\Travel Systems\\GDS\\AS400 will be an advantage .Experience with global customers will be a plus. .Location .India>Haryana>Gurgaon .It is our policy to provide equal employment opportunities to all individuals based on job-related qualifications and ability to perform a job, without regard to age, gender, gender identity, sexual orientation, race, color, religion, creed, national origin, disability, genetic information, veteran status, citizenship or marital status, and to maintain a non-discriminatory environment free from intimidation, harassment or bias based upon these grounds. .GBT Recruitment Privacy Statement"
