,Name,Company,City,Location,Url,JOB_INFO
9,Data Analyst, Druva,Pune,Pune,https://www.glassdoor.com/partner/jobListing.htm?pos=110&ao=636124&s=58&guid=00000170cffb9c4aa3da733ec471e391&src=GD_JOB_AD&t=SR&extid=1&exst=OL&ist=&ast=OL&vt=w&slr=true&cs=1_faada86f&cb=1584037338422&jobListingId=3516223755,"Data Analyst .at Druva .(View all jobs) .Pune .Druva is the global leader in Cloud Data Protection and Management, delivering the industry’s first data management-as-a-service solution that aggregates data from endpoints, servers and cloud applications and leverages the public cloud to offer a single pane of glass to enable data protection, governance and intelligence–dramatically increasing the availability and visibility of business critical information, while reducing the risk, cost and complexity of managing and protecting it. .Druva’s award-winning solutions intelligently collect data, and unify backup, disaster recovery, archival and governance capabilities onto a single, optimized data set. As the industry’s fastest growing data protection provider, Druva is trusted by over 4,000 global organizations, and protects over 40 PB of data. .Please do visit us at : https://www.druva.com/about/ .You will be part of the team whose responsibilities include analyzing data to find opportunities for reducing cost of operating the Druva SaaS platform. You are passionate about mining data with a keen eye for detail as well as zooming out for bigger picture to identify trends and patterns in data. You will have opportunities to build and augment a system including set of tools that leverage statistical methods to systematically monitor and analyze data on an ongoing basis. You will use the analysis to propose and influence newer initiatives that helps drive down cost of operating Druva SaaS platform. .Key Responsibilities: .Mine, analyze and co-relate data across product and service databases to identify trends, patterns and anomalies in service cost.. .Work with stakeholders across engineering, operations and finance team to propose cost reduction initiatives. .Build and/or enhance system, tools and scripts for monitoring resource usage and costs as well as reporting on trends and predictions. .Respond to cost escalations by performing quick analysis and coming up with root cause analysis for cost increases. .Experience: .Expertise and hands-on experience in data analysis and mining for both numerical data as well as unstructured data using various methods including statistical analysis. .Hands-on experience building and leveraging necessary tools that aid data analysis, including programming experience in Python, R or equivalent languages. .Experience in building and/or leveraging visualization, prediction and recommendation systems. .Experience with SaaS platforms like AWS and services is a must. .Experience with data backup and management SaaS products is a plus. .Strong experience delivering data science projects that drive timely business results and outcome. .Great communication skills in conveying the interpretation and meaning of data to business stakeholders and executive team. .6+ years of industry experience in the domain of data analysis and data science. .Advanced degree in Computer Science and/or Mathematics is a must with desirable specialization in data science. .M.Tech/BE/B.TECH/MCA/MSC/BCA/BCS OR equivalent degree"
10,Tax Data Analyst, Avalara,Pune,Pune,https://www.glassdoor.com/partner/jobListing.htm?pos=111&ao=780430&s=58&guid=00000170cffb9c4aa3da733ec471e391&src=GD_JOB_AD&t=SR&extid=1&exst=OL&ist=&ast=OL&vt=w&slr=true&cs=1_98bb6e76&cb=1584037338423&jobListingId=3505851691,"Avalara Technologies Pvt. Ltd. .Job title: Tax Data Analyst .About us: https://www.avalara.com/about/ .Work Location: Pune, India .Relevant Work Experience: 1-2 Years .Reports to: Manager, Managed Services .Permanent: Yes .Contract: No .Department Overview: Business unit that performs services supplementing the CertCapture product which reduces customers’ exposure in a sales tax audit. Avalara’s Managed Services team handles collection of certificates and related data for processing & ensure every certificate is complete and valid. Compliance with exemption certificates is essential for many companies to give a good experience for their customers and in order not to be penalized under a government audit. Audit penalties can be in the thousands to millions of dollars depending on company size. .Job Overview: Tax Data Analyst position would involve understanding & validating various kind of US based corporate tax documents / Exemption certificates. Further, this position will interface with customers via email. This position requires the ability to learn quickly to start working independently in a fast-paced, dynamic environment where attention to detail, analytical skills and strong communication skills are essential. .Essential Duties and Responsibilities: .Facilitate and manage timely & accurate validation of exemption certificates by verifying the form meets the governmental and customer audit minimum requirements .Proactively and reactively communicate with customers via email .Ability to meet the SLA’s and ensuring accurate and timely reporting .Communicate to manager ongoing status and correctly escalate issues as needed .Find and implement opportunities for process improvement and build efficiency .Stay abreast of all the updates & trends, support overall production/Accuracy goals .Qualifications: .Ability to learn technology quickly .Excellent communication – strong written and oral English skills .Willing to work in overlapping timings .Excellent logical and analytical skills .Knowledge of Windows, MS Word, MS Excel is a must .Excellent Organizational skills .Team player .Nice to have - experience / knowledge in sales tax domain"
11,Data Analyst, Ractus Services,Pune,Pune,https://www.glassdoor.com/partner/jobListing.htm?pos=112&ao=437149&s=58&guid=00000170cffb9c4aa3da733ec471e391&src=GD_JOB_AD&t=SR&extid=1&exst=OL&ist=&ast=OL&vt=w&slr=true&cs=1_0d01e6ed&cb=1584037338423&jobListingId=3523836019,"ïƒ˜MUST HAVE SKILL SET .ïƒ˜Intermediate to advanced SQL query techniques for writing optimized SQL scripts, stored procedures and views. .ïƒ˜Comprehensive understanding of data warehouse design principles. .ïƒ˜Experience in automating data import and extract processes using SQL tools such as Azure Data Factory and SSIS. Must have ability to perform data mapping and assess complex data sets. .ïƒ˜Strong experience working with Power BI and SSAS to deliver insightful analytics .ïƒ˜Expert in analyzing and troubleshooting data issues providing solutions and looking ahead to improve processes in place .ïƒ˜OTHERS .ïƒ˜Build effective and visually rich presentation to represent data in a meaningful way. .ïƒ˜Ability to conduct research over data sets to respond to inquiries by business stakeholders. .ïƒ˜Ability to effectively interpret the results of research, organize findings in a manner easily understood by end users, and the ability to articulate the results to end users. .ïƒ˜The ability to provide reliable information and communicate easily with persons at all levels, including senior management, internal business units, software developers, Quality Assurance, and other IT units. .ïƒ˜Designs and develops a variety of ad-hoc and standard reports. .ïƒ˜Designs and develops data security structures. .ïƒ˜Creates and maintains documentation for both IT standards and end-user assistance. .ïƒ˜Trains users in the use of ad-hoc reporting. .ïƒ˜Develops and maintains the data warehouse reporting environment .ïƒ˜Works with key business representatives to gather and define reporting needs. .ïƒ˜Designs and develops KPI dashboards for business stakeholders. .ïƒ˜Troubleshoots and resolves data/reporting issues. .ïƒ˜Use statistical methods to analyze data and generate useful business reports .ïƒ˜Strong experience with Power BI, Excel, SQL Server and other querying and reporting tools .ïƒ˜Good understanding of machine learning and data analytics .ïƒ˜Experience with R Studio and Python is a plus .ïƒ˜Experience in processing large amounts of data .ïƒ˜Processing confidential data and information according to guidelines. .ïƒ˜Managing and designing the reporting environment, including data sources, security, and metadata. .ïƒ˜Supporting the data warehouse in identifying and revising reporting requirements. .ïƒ˜Providing technical expertise on data storage structures, data mining, and data cleansing .2-6 Years .Bachelor Of Computer Application (B.C.A), Master in Computer Application (M.C.A), Post Graduate Diploma in Computer Applications (PGDCA)"
12,Talent & Career Data Analyst/Specialist, FIS,Pune,Pune,https://www.glassdoor.com/partner/jobListing.htm?pos=113&ao=875758&s=58&guid=00000170cffb9c4aa3da733ec471e391&src=GD_JOB_AD&t=SR&extid=1&exst=OL&ist=&ast=OL&vt=w&slr=true&cs=1_7ed41435&cb=1584037338424&jobListingId=3491206313,"Position Type .Full time - Regular .Type of Hire .Experienced (relevant combo of work and education) .Education Desired .Master of Business Administration .Travel Percentage .25% .Job Description .Are you curious, motivated, and forward-thinking? At FIS, youll have the opportunity to work on some of the most challenging and relevant issues in financial services and technology. Our talented people empower us, and we believe in being part of a team that is open, collaborative, entrepreneurial, passionate and above all fun. .About the team .Talent & Career Enablement Team supports the execution of overall Talent & Career function. Our team is responsible for providing support to the leads in developing and delivering resources for whole of FIS. Key focus areas for this role include - Performance Management/Performance365, Talent and Digital Solutions, Career and Talent Partnering Support, Succession Planning Tools and Process, Research and content design & Process Improvement .What you will be doing: .Helping to produce regular Project and Program level reports for Talent & Career COE senior management and other key stakeholders. .Provide support to Senior Data Analyst in the team for various Automation and Reporting related tasks. .Prepare global dashboards by leveraging on available internal tools such as Workday and Visier. .Ability to innovate and recommend process and system enhancements for effective user experience as part of product/service designing. .Stay abreast of any process/system changes and guide stakeholders in implementation. .Supports the development and facilitation of training for People Office, business leaders and employees around associate tools and processes. .Ensures data quality and follows global data standards .What you bring: .3-5 years in a Human Resources with projects/background work as Data Analyst or MIS background preferred. .Has Exposure to workforce analytics- either as a user or a designer/analyst .Worked on HRIS Tools (preferably workday) .Experience creating support materials and benchmarking. .Experience working with large data files to analyze data and create various reports .Ability to maintain confidentiality .Must possess excellent verbal and written communication skills and be able to effectively communicate across multiple job levels both in and outside of the People Office function. .Proficient in Microsoft Office suite, specifically Excel, PowerPoint, and SharePoint. .Excellent customer service, problem solving, and multi-tasking skills .Demonstrated ability merge multiple sources of data and conduct analysis to identify trends and uncover insights. .Ability to work in a Global Matrix Environment and is Flexible working in different time zones as and when needed .Tolerance for change in transforming organization and developing Talent & Career team .What we offer you: .A multifaceted job with a high degree of responsibility and a broad spectrum of opportunities .A broad range of professional education and personal development possibilities FIS is your final career step! .A competitive salary and benefits .A variety of career development tools, resources and opportunities .Privacy Statement .FIS is committed to protecting the privacy and security of all personal information that we process in order to provide services to our clients. For specific information on how FIS protects personal information online, please see the Online Privacy Notice. .Sourcing Model .Recruitment at FIS works primarily on a direct sourcing model; a relatively small portion of our hiring is through recruitment agencies. FIS does not accept resumes from recruitment agencies which are not on the preferred supplier list and is not responsible for any related fees for resumes submitted to job postings, our employees, or any other part of our company."
13,Junior Data Analyst, Cognizant,Pune,Pune,https://www.glassdoor.com/partner/jobListing.htm?pos=114&ao=437149&s=58&guid=00000170cffb9c4aa3da733ec471e391&src=GD_JOB_AD&t=SR&extid=1&exst=OL&ist=&ast=OL&vt=w&slr=true&cs=1_829a254a&cb=1584037338425&jobListingId=3505099267,"Team Lead - CDM/PV .Qualification: .Graduate/Post Graduate/ Doctorate degree in life sciences/Pharmacy/Medical sciences/Registered Nurse .Responsibility: .Business/ Customer: .Minimal Customer interaction under guidance. .Understands Domain Process/sub process, functions, terminologies (such as SOP, QC checklists). .For PV/Complaints Management Individuals in this role perform data entry of data received from Source documents into the respective Clinical/Safety database While peroforming this activity the associate is responsible for meeting turnaround times and accuracy. .These associates are usually used to handle more critical/senitive transactions. .CODING: .(same as PE) .Perform coding activities on the assigned project with timelines and efficiency. .• Import uncoded terms in database and export coded medical terms from coding platform. .• Query Management. .• Create “New Term Request” and prioritize. .• Perform Dictionary upversioning activity as and when required. .CDM: .Performs Migrations / Set up / Close out activities apart from Study Conduct activities under supervision and quality checks from Team Lead. .May do the Peer QC of the TJDA activities. .Generates all study related reports, status updates, and carries out all study related email conversation and communication with internal stakeholders and Client. .Project / Process: .Attempts Complex problems (procedures/processes) and refers to Supervisor/Line Manager in rare cases. .Handle first level processing of transactions. .Adhere to quality requirements, achieve targets/volumes in given TAT(Turn around time). .Proactively identify issues. .Contribute to process improvement initiatives. .Identify and report process changes. .Adhere to the mandatory industry regulation and compliance requirements for the given process. .Knowledge Management: .Update Process documentation as appropriate for the process under guidance. .Participate in knowledge transfer. .People/Team Management: .Adhere to org hygiene and compliance needs in terms of. .a Personal Utilization & Time sheet submission. .b Personal and new hire Assimilation. .c Attendance. .d Team Initiatives. .Collate team performance metrics. .Manage break schedule/transport logistics for the team in the absence of his/her supervisor. .Domain Skills .SNoPrimary SkillProficiency Level *Rqrd./Dsrd. .1Pharmacovigilance&Safety OpsNADesired .2PV Case ProcessingNADesired .Proficiency Legends .Proficiency LevelGeneric Reference .PL1The associate has basic awareness and comprehension of the skill and is in the process of acquiring this skill through various channels. .PL2The associate possesses working knowledge of the skill, and can actively and independently apply this skill in engagements and projects. .PL3The associate has comprehensive, in-depth and specialized knowledge of the skill. She / he has extensively demonstrated successful application of the skill in engagements or projects. .PL4The associate can function as a subject matter expert for this skill. The associate is capable of analyzing, evaluating and synthesizing solutions using the skill. .Employee Status : .Full Time Employee .Shift : .Day Job .Travel : .No .Job Posting : .Feb 26 2020 .About Cognizant .Cognizant (Nasdaq-100: .CTSH) is one of the world's leading professional services companies, transforming clients' business, operating and technology models for the digital era. Our unique industry-based, consultative approach helps clients envision, build and run more innovative and efficient businesses. Headquartered in the U.S., Cognizant is ranked 193 on the Fortune 500 and is consistently listed among the most admired companies in the world."
14,Marketing Data Analyst, Veritas,Pune,Pune,https://www.glassdoor.com/partner/jobListing.htm?pos=115&ao=825928&s=58&guid=00000170cffb9c4aa3da733ec471e391&src=GD_JOB_AD&t=SR&extid=1&exst=OL&ist=&ast=OL&vt=w&slr=true&cs=1_81c36c73&cb=1584037338426&jobListingId=3497235913,"About VERITAS .Veritas solves what no one else can. With an industry-leading product portfolio, we offer proven, modern, and integrated technology that brings together .availability ., .protection ., and .insights .. Our Veritas Enterprise Data Services Platform addresses current and future data issues end-to-end – keeping mission-critical workloads highly available, protecting data everywhere, and providing insights to optimize costs and maintain regulatory readiness. .Veritas supports 500+ data sources, 150+ storage targets, 50+ clouds, and any deployment model imaginable. We serve 99% of the Fortune 100, 90% of the Fortune 500, and are the market leader in Software-defined Storage, Data Protection, and Archiving. .Veritas’ Worldwide Field Operations (WFO) propels company growth by driving all aspects of new business and channel sales and includes global sales operations and global sales enablement for all new business and renewal sales. .Job Title: .Marketing Data Analyst .Location: .EON IT Park, Pune, India .Team: Center for Operations Excellence (COE) .COE is a shared resource center for Global Sales Operation and provides various sales operations services to Global, Americas, EMEA and the Asia Pacific teams. .Role Overview .The primary responsibility of the Marketing Data Analyst will be to manage Leads to Opportunity process and improve pipeline potential for marketing investments. This will include marketing Data management, reporting and analysis. .The individual will work closely with multiple teams including marketing operations, sales, CRM operations. Will also serve as the first point of contact for the marketing team to address marketing data-related requests. .Responsibilities .: .Responsible for managing the marketing operations seamlessly and timely SLA delivery along with maintaining high levels of customer satisfaction .Improve marketing Process by simplify, standardize and automate .Own marketing opportunity creation process .Ensure correct rep and territories are assigned to opportunities .Manager Leads creating process using Eloqua .Work with Regional marketing team to create reporting & insights using marketing data .Address data quality GAPs and maintain sales data hygiene .Coordinate and facilitate meetings with diverse business and technical stakeholders .Facilitate change management by developing and executing communications plans, assigning roles and defining accountabilities, conduct user training and creating training documentation, provide ongoing user support, implement reports and dashboards, etc. .Key Skills: .Overall 5-7 year of experience with 2-3 year of experience in leads to opportunity process .Experience working with Americas sales team .Knowledge of Sales Cycle and its basic requirements .Hands-on experience in Advanced Excel & VBA Macros .Ability to build relationships with key stakeholders .Self-starter and a proactive can-do innovative attitude .Requires excellent communication skills, cross-functional experience and strong interpersonal skills .Results and detail-oriented with the ability to manage conflicting priorities effectively .Strong written and verbal communication skills .Ability to adopt frequent process changes .Prior experience in sales operations and marketing process .Good understanding of Sales Territories & Customer Data .Awareness of Marketing best practice .Qualifications .: .Proficiency and previous experience with marketing and CRM process .Proficiency and previous experience with Excel .Experience in managing, extracting and cleansing high volumes of transactional data .Results and detail-oriented with the ability to manage conflicting priorities effectively .Excellent communication skills, cross-functional experience and strong interpersonal skills .Strong written and verbal communication skills .Strong mathematical/analytical background with the ability to understand complex data and resolve difficult problems .Technologies .: .• Oracle CRM, Data Loader Tool .• Microsoft Excel, Access, PowerPoint .• Eloqua .At Veritas, we care about the causes close to your heart and enable you to volunteer, donate, and do good. We also value uniqueness and know that a more diverse and inclusive workforce makes a winning team, so come as you are! Interested? Then apply and find out more about #TeamVTAS!"
15,Data Analyst, Seven Mentor,Pune,Pune,https://www.glassdoor.com/partner/jobListing.htm?pos=116&ao=437149&s=58&guid=00000170cffb9c4aa3da733ec471e391&src=GD_JOB_AD&t=SR&extid=1&exst=OL&ist=&ast=OL&vt=w&slr=true&cs=1_24ab23d3&cb=1584037338427&jobListingId=3377773221,"You will be an active part of Business Value Monitoring team. The Business Value Monitoring TM .(BVM) is a 24/7 Digital Platform that looks after the KPI’s that really matter in the Business of .Renewable Energy sources like Wind, Hydro, Solar, etc. .You shall progressively develop as a technical expert to analyse technical issues, experiment, operate and improvise the effectiveness of Energy Studio Pro application that is built on a state of the art software & hardware integrated platform. .You will interact with multi-nation users & experts to support the Energy Studio Pro software technical support. .Before getting in to operations, you will undertake extensive learning of Energy studio within the country the company premises or projects. .SKILLS SET: .Good knowledge of MSSQL database and system level Windows operating system. .Strong problem solving, troubleshooting and analytical skills, imaginative & logical soundness. .Hands on work in designing and querying MSSQL databases. .Excellent communication skills, statistical acumen, keen attention to detail, and a passion for learning new. .Certification: .Bog data, Hadoop, Data science preferred .Qualification: .B.Tech / BCA/MCA/MCM/BSC (Completed)"
