,Name,Company,City,Location,Url,JOB_INFO
16,"Data Analyst, Customer Visibility"," Coupa Software, Inc.",Pune,Pune,https://www.glassdoor.com/partner/jobListing.htm?pos=117&ao=838791&s=58&guid=00000170cffb9c4aa3da733ec471e391&src=GD_JOB_AD&t=SR&extid=1&exst=OL&ist=&ast=OL&vt=w&slr=true&cs=1_96ddd8ab&cb=1584037338428&jobListingId=3482913204,"Coupa Software (NASDAQ: COUP), a leader in business spend management (BSM), has been certified as a “Great Place to Work” by the Great Place to Work organization. We deliver “Value as a Service” by helping our customers maximize their spend under management, achieve significant cost savings and drive profitability. Coupa provides a unified, cloud-based spend management platform that connects hundreds of organizations representing the Americas, EMEA, and APAC with millions of suppliers globally. The Coupa platform provides greater visibility into and control over how companies spend money. Customers – small, medium and large – have used the Coupa platform to bring billions of dollars in cumulative spend under management. Learn more at www.coupa.com. Read more on the Coupa Blog or follow @Coupa on Twitter. .Do you want to work for Coupa Software, the world's leading provider of cloud-based spend management solutions? We’re a company that had a successful IPO in October 2016 (NASDAQ: COUP) to fuel our innovation and growth. At Coupa, we’re building a great company that is laser focused on three core values: .1. Ensure Customer Success .– Obsessive and unwavering commitment to making customers successful. .2. Focus On Results .– Relentless focus on delivering results through innovation and a bias for action. .3. Strive For Excellence .– Commitment to a collaborative environment infused with professionalism, integrity, passion, and accountability. .Responsibilities .Develop and present compelling data driven analysis of customer spend data. .Maintain Coupa Customer Visibility tools, dashboards and reports. .Support Customer Value Management team with product adoption/usage analysis. .Support the Sales and the Business Value Engineering team with customer spend data analysis. .Work collaboratively within Customer Visibility team to develop the practice. .Focus on Python based development to do trend analysis on adoption. .Identify data issues and proactively drive cleanup activities. .Requirements .Basic data analysis skills such as basic statistics, understanding how to investigate the relationship between variables, identifying trends and correlations in data, and ability to determine the appropriate charts/graphs that provide meaningful insights. .Basic research skills such as determining appropriate ways to search for and gather information regarding industry studies and external analyst benchmarks, filtering which information and sources are relevant to the project scope, and aligning the findings to data and models used by Coupa. .Strong Excel skills including knowledge of advanced functions such as lookups, conditional programming (i.e., if/then), data validation (e.g., data lists), formatting, and ability to make forms and automated tools that can be used by others in a sales execution environment. .Strong Python scripting skills . .Strong PowerPoint skills with the ability to create attractive marketing and sales collateral quickly. .Basic project management skills needed to manage and coordinate projects tasks. This includes creating work plans or project plans, conducting status updates, taking meeting minutes/notes, and proactively following up on open items to ensure completion of tasks. .Effective communication skills including ability to structure ideas and conversations to effectively present findings from research and analysis. .Preferred Qualifications .· Advanced Excel skills – Including use of macros and program using Visual Basic. .· Proficiency of web development languages: HTML, CSS, JavaScript, PHP, SQL .· Knowledge of Analytics and visualization tool like Birst or Tableau .· Knowledge of basic software development life cycle (SDLC) concepts: Agile, Waterfall, etc. .· Bachelors degree in Computer Science or Data Analysis – Masters degree a plus .At Coupa, we have a strong and innovative team dedicated to improving the spend management processes of today’s dynamic businesses. It’s our people who make it happen, and we strive to attract and retain the best in every discipline. .We take care of our employees every way we can, with competitive compensation packages, as well as restricted stock units, an Employee Stock Purchase Program (ESPP), comprehensive health benefits for employees and their families, a 401(k) match, a flexible work environment, no limit vacations for exempt employees, non-exempt employees are on an accrual basis for PTO, catered lunches…And much more! .As part of our dedication to the diversity of our workforce, Coupa is committed to Equal Employment Opportunity without regard for race, ethnicity, gender, protected veteran status, disability, sexual orientation, gender identity or religion. .Please be advised, inquiries or resumes from recruiters will not be accepted."
17,Business Data Analyst, Red Hat,Pune,Pune,https://www.glassdoor.com/partner/jobListing.htm?pos=118&ao=876271&s=58&guid=00000170cffb9c4aa3da733ec471e391&src=GD_JOB_AD&t=SR&extid=1&exst=OL&ist=&ast=OL&vt=w&slr=true&cs=1_13596f24&cb=1584037338429&jobListingId=3501506979,"At Red Hat, we connect an innovative community of customers, partners, and contributors to deliver an open source stack of trusted, high-performing solutions. We offer cloud, Linux, middleware, storage, and virtualization technologies, together with award-winning global customer support, consulting, and implementation services. Red Hat is a rapidly growing company supporting more than 90% of Fortune 500 companies. .The Red Hat Products and Technologies (PnT) Business Insights team is looking for a Business Analyst who is passionate about solving business problems, automating data, and reporting needs using analytics tools to join us in Pune, India. You will be responsible for gathering business requirements, developing measurement strategies, and assigning program key performance indicators (KPIs). You will measure performance, analyze customer behavior and trends, build dashboards, and transform raw data into actionable insights that guide business decisions. .Work cross-functionally with leadership, program managers, data analysts, and other stakeholders to understand and achieve business priorities .Elicit business requirements and develop measurement plans for strategic programs .Understand business problems in detail with all nuances .Map the solution to data domain and generate the SQL workflow .Collect and analyze data through manual and automated collection methods .Interpret data, analyze results using analytics techniques, and provide ongoing reports .Develop and implement databases, data collection systems, data analytics, and other strategies that optimize statistical efficiency and quality .Identify, analyze, and interpret trends or patterns in complex data sets .Technical expertise regarding data models, database design development, data mining, data cleansing, and data extraction and segmentation techniques .Translate abstract data into easily digestible and highly visual dashboard applications and executive-level report deliverables .Collaborate with other analysts, data engineers, and data scientists to provide exceptional customer support to our internal stakeholders .Analyze large data sets and translate abstract data into highly visual and easily digestible formats .2-5 years of experience working in a data analyst role .Excellent communication, organization, and time-management skills .Ability to interpret large amounts of data and handle multiple priorities at the same time .Adequate knowledge of data collection methods .Working knowledge of data warehousing, modeling, and mining .Practical experience with handling data .Solid knowledge of and experience with reporting packages like Tableau, Qlik Sense, or SAP BusinessObjects etc., databases like SQL, etc., and with programming like Python or R .Solid analytical skills with the ability to collect, organize, analyze, and disseminate significant amounts of information with attention to detail and accuracy .Good knowledge of extract, transform, and load (ETL) concepts .Solid analytical and critical thinking skills .Proven record of translating business objectives and requirements into prioritized, action-oriented deliverables with measurable success criteria .Passionate about data-driven decision making and ability to perform analysis on large datasets .Advanced spreadsheet data manipulation skills .Ability to work well in a team and effectively interact with partners and stakeholders at all levels and across global regions .Ability to self-direct and self-motivate with minimal direction .Ability to adapt quickly to shifting priorities .Knowledge of statistics and experience using statistical packages for analyzing datasets .Good knowledge of open source .Red Hat is proud to be an equal opportunity workplace and an affirmative action employer. We review applications for employment without regard to their race, color, religion, sex, sexual orientation, gender identity, national origin, ancestry, citizenship, age, veteran status, genetic information, physical or mental disability, medical condition, marital status, or any other basis prohibited by law. .Red Hat does not seek or accept unsolicited resumes or CVs from recruitment agencies. We are not responsible for, and will not pay, any fees, commissions, or any other payment related to unsolicited resumes or CVs except as required in a written contract between Red Hat and the recruitment agency or party requesting payment of a fee."
18,"Analyst, Data and Insight", Cotiviti India,Pune,Pune,https://www.glassdoor.com/partner/jobListing.htm?pos=119&ao=437149&s=58&guid=00000170cffb9c4aa3da733ec471e391&src=GD_JOB_AD&t=SR&extid=1&exst=OL&ist=&ast=OL&vt=w&slr=true&cs=1_da72ba9c&cb=1584037338429&jobListingId=3505297075,"The Data & Insight Analyst is responsible for architecting and developing best-in-class and innovative analytics and reporting solutions. This role will have responsibility for establishing, running, and sustaining processes and practices that support Big Data, Analytics, and Reporting solutions and applications in an Open Source environment. The Data & Insight Analyst should have a passion for data, working with business people, and creating solutions and driving value with a keen interest in mentoring and elevating other technical resources. This role will spend time working independently and as part of a team and will focus on specific deadlines in an Agile development process as defined by the management team. .Primary Responsibilities .Architect and hands-on development of Analytics and Reporting solutions .Implementing and configuring reporting technologies like Tableau and Microstrategy .Proficient with SQL for databases like Oracle, PostgreSQL, and MySQL .Architect, design, build and integrate solutions using Hadoop and other big data tools such as: Scala/Spark, R, Pig, etc. This also includes redesigning existing reports for enhanced utility and usability. .Managing the day-to-day activities of the Analytics Center of Excellence, which is tasked with delivering data-driven recommendations by applying analytics within a Hadoop environment .Drive automation capabilities into reporting solutions .Establish credibility and strong working relationship with development teams to review design and code for adherence to established standards and best practices .Deliver using an Agile development process .Maintain our repository and other relevant documentation .Consulting skills strong enough to work with clients on their analytic needs .Minimum Qualifications: .2+ years’ experience in advanced analytics .2+ years’ experience delivering actionable insights from data .Experience in typical and big data analytics environments .Experience with business intelligence (data visualization and dashboarding, Tableau, etc) .Experience with multiple scripting languages (Scala, R, Python, etc.) .Experience with SQL syntax for multiple databases (e.g., standard SQL, Oracle, MySQL, PostgreSQL) .Experience in Agile environment .Experience with healthcare billing and coding .Out of the box thinking and creativity are essential .Ability to work independently as well as collaborate as a team .Must be able to sit and use a computer keyboard for extended periods of time .Must be able to lift up to 20 lbs without assistance .After hours / weekend work required where necessary for major deliverables / deadlines (not consistent) .Must have flexibility and willingness to participate in the work processes of an international organization, including conference calls scheduled to accommodate global time zones. .Additional Qualifications: .Understands claims data, how data is stored in analytical platforms, and how to use and apply claims data in the validation of payment accuracy concepts and other projects. .Knowledge and ability to use Statistical methodology to solve business problems .Ability to understand, generate and evaluate healthcare utilization, unit cost and medical cost trends. This includes understanding levers that effect healthcare cost, such as contracting, networks, policies, benefit structures, and product design. Ability to draw conclusions and make recommendations based on financial data .Ability to actively and skillfully conceptualize, apply, analyze, synthesize, and/or evaluate information gathered from, or generated by, observation, experience, reflection, reasoning, or communication, as a guide to belief and action .Ability to make recommendations with authority to other departments or individuals (acting as clients) .Has an understanding of the basic tenets of health insurance, the managed care model, Commercial, Medicare & Medicaid rules, industry coding/policy standards, the claim adjudication process, and issues related to fraud waste and abuse; Ability to apply this knowledge to the development & evaluation of new initiatives and lead the team strategy toward best practices. OR, Developing and maintaining and understanding of the basic tenets of retail auditing and our clients to develop and evaluate new initiatives and best practices .Ability to appropriately summarize and effectively communicate complex concepts & varied data sets to inform stakeholders, gain approval, or prompt actions; Applies to multiple audiences ranging from the analyst to executive level; Includes oral & written communication and multimedia presentation .Proficient with Microsoft Office Suite (Word, Excel, Power Point) .Familiarity and ability to quickly learn big data analysis techniques (e.g., Scala, R) .Familiarity with data warehousing concepts"
19,Commodities Front Office (ML/AI) data analyst - Renaultid, Citibank,Pune,Pune,https://www.glassdoor.com/partner/jobListing.htm?pos=120&ao=37049&s=58&guid=00000170cffb9c4aa3da733ec471e391&src=GD_JOB_AD&t=SR&extid=1&exst=OL&ist=&ast=OL&vt=w&slr=true&cs=1_f62d6048&cb=1584037338430&jobListingId=3466326223,"Job brief .An exciting role for a Machine Learning (ML) engineer to help create artificial intelligence products for the Commodities business. The ML engineer responsibilities include creating machine learning models and retraining systems. To do this job successfully, exceptional skills in statistics and programming, couple with an innovative spirit is required. Knowledge of data science and software engineering, preferred. .The goal will be to shape and build an efficient self-learning application that enable the users in the Commodities business to optimise returns on sales and trading decisions. The individual will need to have a user focused mind set in order to develop applications which not only meeting their needs, but provides them a competitive advantage in the market. .Responsibilities .Study and transform data science prototypes .Design machine learning systems from the ground up .Research and implement appropriate ML algorithms and tools .Select appropriate datasets and data representation methods .Run machine learning tests and experiments .Perform statistical analysis and fine-tuning using test results .Train and retrain systems when necessary .Extend existing ML libraries and frameworks .Keep abreast of developments in the field .Develop machine learning applications according to requirements .Interact directly with Commodities Sales & Trading personnel globally to ensure applications are meeting their needs .Build and train a team around you as ML applications productionise and mature .Requirements .Proven experience as a Machine Learning Engineer or similar role .Understanding of data structures, data modelling and software architecture .Deep knowledge of math, probability, statistics and algorithms .Ability to write robust code in Python, Java or R .Familiarity with machine learning frameworks (like Keras or PyTorch) and libraries (like scikit-learn) .Excellent communication skills .Ability to work in a team .Outstanding analytical and problem-solving skills .BSc in Computer Science, Mathematics or similar field; Masters degree is a plus .Optional: .Full stack development skills .------------------------------------------------- .Grade :All Job Level - All Job FunctionsAll Job Level - All Job Functions - IN .------------------------------------------------------ .Time Type : .------------------------------------------------------ .Citi is an equal opportunity and affirmative action employer. .Minority/Female/Veteran/Individuals with Disabilities/Sexual Orientation/Gender Identity. .Citigroup Inc. and its subsidiaries (""Citi) invite all qualified interested applicants to apply for career opportunities. If you are a person with a disability and need a reasonable accommodation to use our search tools and/or apply for a career opportunity CLICK HERE. .To view the ""EEO is the Law"" poster CLICK HERE. To view the EEO is the Law Supplement CLICK HERE. .To view the EEO Policy Statement CLICK HERE. .To view the Pay Transparency Posting CLICK HERE."
20,Business Value Data Analyst," Coupa Software, Inc.",Pune,Pune,https://www.glassdoor.com/partner/jobListing.htm?pos=121&ao=838791&s=58&guid=00000170cffb9c4aa3da733ec471e391&src=GD_JOB_AD&t=SR&extid=1&exst=OL&ist=&ast=OL&vt=w&slr=true&cs=1_97655073&cb=1584037338431&jobListingId=3523766906,"Coupa Software (NASDAQ: COUP), a leader in business spend management (BSM), has been certified as a “Great Place to Work” by the Great Place to Work organization. We deliver “Value as a Service” by helping our customers maximize their spend under management, achieve significant cost savings and drive profitability. Coupa provides a unified, cloud-based spend management platform that connects hundreds of organizations representing the Americas, EMEA, and APAC with millions of suppliers globally. The Coupa platform provides greater visibility into and control over how companies spend money. Customers – small, medium and large – have used the Coupa platform to bring billions of dollars in cumulative spend under management. Learn more at www.coupa.com. Read more on the Coupa Blog or follow @Coupa on Twitter. .Do you want to work for Coupa Software, the world's leading provider of cloud-based spend management solutions? We’re a company that had a successful IPO in October 2016 (NASDAQ: COUP) to fuel our innovation and growth. At Coupa, we’re building a great company that is laser focused on three core values: .1. Ensure Customer Success .– Obsessive and unwavering commitment to making customers successful. .2. Focus On Results .– Relentless focus on delivering results through innovation and a bias for action. .3. Strive For Excellence .– Commitment to a collaborative environment infused with professionalism, integrity, passion, and accountability. .Coupa delivers leading Business Spend Management (BSM) capabilities to our customers, enabling them to maximize the value of every dollar they spend. To help customers realize measurable business value, it is critical to provide customers meaningful insights about their business spending environment based on data analysis. .This role is part of the Value Excellence Center within the Business Value Engineering (BVE) team. BVE Team is a global team of finance/management consultants who develop business cases that articulate how business value will be realised using Coupa’s solutions. .The Value Excellence Center is a global center of excellence focused on driving measurable business value for Coupa and its customers by providing insights using data analysis. The Value Excellence Center primarily supports the BVE team by providing data-driven business cases which require complex data analysis. The Value Excellence Center also supports other internal organizations within Coupa with strategic projects. .Roles and Responsibilities: .Build and manage knowledge bases and data sets used by the Business Value Engineering Team .Support sales engagements by performing analysis on spend data provided by customers and delivering meaningful insights for how customers can realize measurable business value with Coupa. .Research and maintain benchmarks. .Build and maintain tools and templates used by the BVE team .Qualifications: .Minimum 3 years of experience in a data analysis role .Basic data analysis skills such as understanding of statistics, understanding how to investigate the relationship between variables, identifying trends and correlations in data, and ability to determine the appropriate charts/graphs that provide meaningful insights. .Strong Microsoft Excel skills including knowledge of advanced functions such as lookups, conditional programming (i.e., if/then), data validation (e.g., data lists), formatting, and ability to make forms and automated tools .Working knowledge of SQL or similar database querying .Experience with Python or other major programming language .Basic understanding of finance and ability to create financial models .Excellent verbal and written communication skills including ability to structure ideas and conversations to effectively present findings from research and analysis. .Must demonstrate intellectual curiosity with a proactive, problem-solving mindset. .Disciplined, self-starter and able to work with limited supervision .Ability to present complex ideas in a clear and concise fashion to technical and non-technical audiences. .Ability to work to tight deadlines and prioritise workload to achieve required timescales. .Bachelor’s degree from an accredited university in finance, accounting, engineering, information management, data science, or economics. .Addition Preferred Qualifications: .Experience of working with a BI tool eg. (Tableau) .Analysis experience in strategic sourcing and procurement with analyzing category spend data .Probabilistic analysis .Experience with working with Big Data .Experience with AI and machine learning algorithms .Strong PowerPoint skills with the ability to quickly create compelling presentations for marketing and sales. .Software development and project management experience (architecture to coding) .Advanced degree from an accredited university in finance, accounting, engineering, information management, data science, or economics. .At Coupa, we have a strong and innovative team dedicated to improving the spend management processes of today’s dynamic businesses. It’s our people who make it happen, and we strive to attract and retain the best in every discipline. .We take care of our employees every way we can, with competitive compensation packages, as well as restricted stock units, an Employee Stock Purchase Program (ESPP), comprehensive health benefits for employees and their families, a 401(k) match, a flexible work environment, no limit vacations for exempt employees, non-exempt employees are on an accrual basis for PTO, catered lunches…And much more! .As part of our dedication to the diversity of our workforce, Coupa is committed to Equal Employment Opportunity without regard for race, ethnicity, gender, protected veteran status, disability, sexual orientation, gender identity or religion. .Please be advised, inquiries or resumes from recruiters will not be accepted."
